{
  "assurances": {
    "decipherment": false,
    "detector_scan_bands_proposal_only": true,
    "identifiers_transcribed": false,
    "layout_candidates_accepted": false,
    "page_classes_visually_audited": true,
    "sign_sequences_transcribed": false,
    "source_page_pixels_crosschecked": true
  },
  "canonicalization": {
    "canonical_pbm_byte_size": 4276113,
    "decoder_crosscheck": "pixel_equal_poppler_pdfimages_26.04.0_and_mupdf_mutool_1.27.2_png_via_pillow_11.3.0",
    "encoding": "P4 newline 4880 space 7010 newline; row-major top-to-bottom, left-to-right, black=1, MSB-first",
    "height": 7010,
    "pixel_payload_byte_size": 4276100,
    "width": 4880
  },
  "layout_evaluation_page_protocol": {
    "development_pdf_pages": [
      20,
      22,
      79,
      129,
      131,
      180
    ],
    "future_evaluation_pdf_pages": [
      8,
      78,
      99,
      128,
      130,
      175
    ],
    "manual_row_values_present": false,
    "selection_scope": "layout-class and boundary coverage only; page identities and pixels are public, manual row labels remain external and absent, and no blind evaluation is claimed"
  },
  "map_id": "KP1979:CORPUS:PAGE-MAP:V1",
  "pages": [
    {
      "canonical_pbm_filename": "page-002.pbm",
      "canonical_pbm_sha256": "sha256:8cfaa902bfc42d2b2d5f5a31edd6755906f6f479763ed2b75e9027958fe30ba6",
      "corpus_sequence_role": "none",
      "label_side": null,
      "layout_class": "non_corpus",
      "contains_linguistic_sequence_candidates": false,
      "page_index": 1,
      "page_role": "non_corpus_negative",
      "pdf_image_object_number": 4961,
      "pdf_page_number": 2,
      "pixel_payload_sha256": "sha256:df4fae399c2a3f809a29e2d55efe38364ef43552232870b8da5bbfde28c11ca0",
      "printed_page_label": "1",
      "proposal_exclusion_bboxes": [],
      "proposal_scan_bands": []
    },
    {
      "canonical_pbm_filename": "page-003.pbm",
      "canonical_pbm_sha256": "sha256:127910470c1de0b3c195a8f071125776b3e946d570338ccbe87562c6c46960cd",
      "corpus_sequence_role": "none",
      "label_side": null,
      "layout_class": "non_corpus",
      "contains_linguistic_sequence_candidates": false,
      "page_index": 2,
      "page_role": "non_corpus_negative",
      "pdf_image_object_number": 10,
      "pdf_page_number": 3,
      "pixel_payload_sha256": "sha256:51abff3a7883532a24312b5fa746a03e8da11f29aa3d2fa33bd66974106e070d",
      "printed_page_label": "2",
      "proposal_exclusion_bboxes": [],
      "proposal_scan_bands": []
    },
    {
      "canonical_pbm_filename": "page-004.pbm",
      "canonical_pbm_sha256": "sha256:d23a95085d9e0522fc4ca2b285cfaaf0f0b6fe59efbbd2c25cdeee2b0cbc3243",
      "corpus_sequence_role": "none",
      "label_side": null,
      "layout_class": "non_corpus",
      "contains_linguistic_sequence_candidates": false,
      "page_index": 3,
      "page_role": "non_corpus_negative",
      "pdf_image_object_number": 13,
      "pdf_page_number": 4,
      "pixel_payload_sha256": "sha256:3cbb162b6cc9efeb146876a2e5361553a73db39872449bbe5ec0a4be892a6dd6",
      "printed_page_label": "3",
      "proposal_exclusion_bboxes": [],
      "proposal_scan_bands": []
    },
    {
      "canonical_pbm_filename": "page-005.pbm",
      "canonical_pbm_sha256": "sha256:07edf00761e2f5594cfca13dda94df0ca0112fcf22c8b91c393430e4ff61afb7",
      "corpus_sequence_role": "none",
      "label_side": null,
      "layout_class": "non_corpus",
      "contains_linguistic_sequence_candidates": false,
      "page_index": 4,
      "page_role": "non_corpus_negative",
      "pdf_image_object_number": 16,
      "pdf_page_number": 5,
      "pixel_payload_sha256": "sha256:a0ef18c706c2ce31e31a6ae7676539db5120160a96288e1141e0d0b8ed9d8bd9",
      "printed_page_label": "4",
      "proposal_exclusion_bboxes": [],
      "proposal_scan_bands": []
    },
    {
      "canonical_pbm_filename": "page-006.pbm",
      "canonical_pbm_sha256": "sha256:7c2eeaed5b5ab2045ecabfc127b461c9a02b7c289f702880c86ac1670d9e6ce2",
      "corpus_sequence_role": "none",
      "label_side": null,
      "layout_class": "non_corpus",
      "contains_linguistic_sequence_candidates": false,
      "page_index": 5,
      "page_role": "non_corpus_negative",
      "pdf_image_object_number": 19,
      "pdf_page_number": 6,
      "pixel_payload_sha256": "sha256:693bbb81e0efa9a596b7e04b5c4b31efbb2a7d4bad53911fa7a2aff84b74c8a6",
      "printed_page_label": "5",
      "proposal_exclusion_bboxes": [],
      "proposal_scan_bands": []
    },
    {
      "canonical_pbm_filename": "page-007.pbm",
      "canonical_pbm_sha256": "sha256:33e9b7920dad0c9818a0f3ab03700affab517588a2a7bda5d041706153b86b55",
      "corpus_sequence_role": "none",
      "label_side": null,
      "layout_class": "non_corpus",
      "contains_linguistic_sequence_candidates": false,
      "page_index": 6,
      "page_role": "non_corpus_negative",
      "pdf_image_object_number": 22,
      "pdf_page_number": 7,
      "pixel_payload_sha256": "sha256:511febd30e3589d4327a7f035bab5020293a87d1e52b36994e0ab520f777f751",
      "printed_page_label": "6",
      "proposal_exclusion_bboxes": [],
      "proposal_scan_bands": []
    },
    {
      "canonical_pbm_filename": "page-008.pbm",
      "canonical_pbm_sha256": "sha256:a79bd28420268295fde099121113422cc29f6d0745e37ffcf762f948a513a2d4",
      "corpus_sequence_role": "none",
      "label_side": null,
      "layout_class": "non_corpus",
      "contains_linguistic_sequence_candidates": false,
      "page_index": 7,
      "page_role": "non_corpus_negative",
      "pdf_image_object_number": 25,
      "pdf_page_number": 8,
      "pixel_payload_sha256": "sha256:a7cd4ee593dc308c1d96668c41ed56a1c571453c4d8a01652c16e895be016fc2",
      "printed_page_label": "7",
      "proposal_exclusion_bboxes": [],
      "proposal_scan_bands": [
        [
          2056,
          550,
          2316,
          6600
        ],
        [
          4232,
          550,
          4492,
          6600
        ]
      ]
    },
    {
      "canonical_pbm_filename": "page-009.pbm",
      "canonical_pbm_sha256": "sha256:2e3bda45578db44206625f7f80cf15d636e709e74e0a057acb3e9a5c9e07cfbd",
      "corpus_sequence_role": "none",
      "label_side": null,
      "layout_class": "non_corpus",
      "contains_linguistic_sequence_candidates": false,
      "page_index": 8,
      "page_role": "non_corpus_negative",
      "pdf_image_object_number": 28,
      "pdf_page_number": 9,
      "pixel_payload_sha256": "sha256:570bfefd2e8c03b2297cbfb3a3ff27d0357a6b0204e58ac983a72a1a150b05ae",
      "printed_page_label": "8",
      "proposal_exclusion_bboxes": [],
      "proposal_scan_bands": []
    },
    {
      "canonical_pbm_filename": "page-010.pbm",
      "canonical_pbm_sha256": "sha256:b93722a2e4dc02ca21ce7f6b985769a60a1c1835bd3884aaed0fe9237e267408",
      "corpus_sequence_role": "none",
      "label_side": null,
      "layout_class": "non_corpus",
      "contains_linguistic_sequence_candidates": false,
      "page_index": 9,
      "page_role": "non_corpus_negative",
      "pdf_image_object_number": 31,
      "pdf_page_number": 10,
      "pixel_payload_sha256": "sha256:a0aa730593590867416143e5df171f8eeb7b7ba40c3152b94e4755907801f795",
      "printed_page_label": "9",
      "proposal_exclusion_bboxes": [],
      "proposal_scan_bands": []
    },
    {
      "canonical_pbm_filename": "page-011.pbm",
      "canonical_pbm_sha256": "sha256:86802f95c19a75c66a4fabc46433b27d6f7aa69ced6e5a26aee70800914a7211",
      "corpus_sequence_role": "none",
      "label_side": null,
      "layout_class": "non_corpus",
      "contains_linguistic_sequence_candidates": false,
      "page_index": 10,
      "page_role": "non_corpus_negative",
      "pdf_image_object_number": 34,
      "pdf_page_number": 11,
      "pixel_payload_sha256": "sha256:6ae4b6b8d980f02c0ce7ce4c0792f3acd0dc5877f9c19e034e343e44dc08b65a",
      "printed_page_label": "10",
      "proposal_exclusion_bboxes": [],
      "proposal_scan_bands": []
    },
    {
      "canonical_pbm_filename": "page-012.pbm",
      "canonical_pbm_sha256": "sha256:064e5a227179c62ae8f2c2fab4af7667bac9e406db50f3bb4ca2280ac8385092",
      "corpus_sequence_role": "none",
      "label_side": null,
      "layout_class": "non_corpus",
      "contains_linguistic_sequence_candidates": false,
      "page_index": 11,
      "page_role": "non_corpus_negative",
      "pdf_image_object_number": 37,
      "pdf_page_number": 12,
      "pixel_payload_sha256": "sha256:a1a70d43fc77fe5c5d0f85c260a02a4baf6ec29e509e0a89bb24b306c4a56c44",
      "printed_page_label": "11",
      "proposal_exclusion_bboxes": [],
      "proposal_scan_bands": []
    },
    {
      "canonical_pbm_filename": "page-013.pbm",
      "canonical_pbm_sha256": "sha256:5b32d61e8e55a998a4bf0175ab77f8004492e06316d11cfb24c4577239d4eae4",
      "corpus_sequence_role": "none",
      "label_side": null,
      "layout_class": "non_corpus",
      "contains_linguistic_sequence_candidates": false,
      "page_index": 12,
      "page_role": "non_corpus_negative",
      "pdf_image_object_number": 40,
      "pdf_page_number": 13,
      "pixel_payload_sha256": "sha256:a87edc1389727a9b9e714973b091dc7446bd09023f6064bd7143d459c2f5160b",
      "printed_page_label": "12",
      "proposal_exclusion_bboxes": [],
      "proposal_scan_bands": []
    },
    {
      "canonical_pbm_filename": "page-014.pbm",
      "canonical_pbm_sha256": "sha256:1f9514de5e4d9e9cfd5ff701a399070b2d1c31d9c25cfdfd61dd2f4dc15a92ef",
      "corpus_sequence_role": "none",
      "label_side": null,
      "layout_class": "non_corpus",
      "contains_linguistic_sequence_candidates": false,
      "page_index": 13,
      "page_role": "non_corpus_negative",
      "pdf_image_object_number": 43,
      "pdf_page_number": 14,
      "pixel_payload_sha256": "sha256:e9c66c4e46ca7e0a75b2d7d5c5b49f2a2ba19bbbed7786ee3a8a763a12cfa6ba",
      "printed_page_label": "13",
      "proposal_exclusion_bboxes": [],
      "proposal_scan_bands": []
    },
    {